{
  "schema_version": 1,
  "generated_at": "2026-02-16T12:30:00Z",
  "repository": "njfio/Tau",
  "source_mode": "live",
  "environment": {
    "os": "darwin",
    "arch": "arm64",
    "shell": "zsh",
    "python_version": "3.14.2",
    "rustc_version": "rustc 1.90.0 (1159e78c4 2025-09-14) (Homebrew)",
    "cargo_version": "cargo 1.90.0 (Homebrew)",
    "cpu_count": 10
  },
  "summary": {
    "command_count": 3,
    "run_count": 3,
    "failing_runs": 0,
    "slowest_command_id": "test-runtime-no-run"
  },
  "commands": [
    {
      "id": "check-tools",
      "command": "cargo check -p tau-tools --lib --target-dir target-fast",
      "run_count": 1,
      "stats": {
        "count": 1,
        "avg_ms": 3175,
        "p50_ms": 3175,
        "min_ms": 3175,
        "max_ms": 3175
      },
      "nonzero_exit_count": 0,
      "invocation": "/bin/bash -lc \"cargo check -p tau-tools --lib --target-dir target-fast\""
    },
    {
      "id": "test-runtime-no-run",
      "command": "cargo test -p tau-github-issues-runtime --target-dir target-fast --no-run",
      "run_count": 1,
      "stats": {
        "count": 1,
        "avg_ms": 4937,
        "p50_ms": 4937,
        "min_ms": 4937,
        "max_ms": 4937
      },
      "nonzero_exit_count": 0,
      "invocation": "/bin/bash -lc \"cargo test -p tau-github-issues-runtime --target-dir target-fast --no-run\""
    },
    {
      "id": "test-trainer-regression",
      "command": "cargo test -p tau-trainer --target-dir target-fast benchmark_artifact::tests::regression_summary_gate_report_manifest_ignores_non_json_files -- --nocapture",
      "run_count": 1,
      "stats": {
        "count": 1,
        "avg_ms": 2252,
        "p50_ms": 2252,
        "min_ms": 2252,
        "max_ms": 2252
      },
      "nonzero_exit_count": 0,
      "invocation": "/bin/bash -lc \"cargo test -p tau-trainer --target-dir target-fast benchmark_artifact::tests::regression_summary_gate_report_manifest_ignores_non_json_files -- --nocapture\""
    }
  ],
  "hotspots": [
    {
      "id": "test-runtime-no-run",
      "command": "cargo test -p tau-github-issues-runtime --target-dir target-fast --no-run",
      "avg_ms": 4937,
      "rank": 1
    },
    {
      "id": "check-tools",
      "command": "cargo check -p tau-tools --lib --target-dir target-fast",
      "avg_ms": 3175,
      "rank": 2
    },
    {
      "id": "test-trainer-regression",
      "command": "cargo test -p tau-trainer --target-dir target-fast benchmark_artifact::tests::regression_summary_gate_report_manifest_ignores_non_json_files -- --nocapture",
      "avg_ms": 2252,
      "rank": 3
    }
  ]
}
